{
  "id": "proj_tobrojekt_site",
  "slug": "tobrojekt-dev",
  "title": "tobrojekt.dev",
  "summary": "Personal project hub and portfolio for Tobias.",
  "description": "A growing home for all my projects, with clear structure and room to expand.",
  "status": "active",
  "tags": ["portfolio", "site"],
  "categories": ["personal"],
  "roles": ["owner", "developer"],
  "skills": ["information-architecture", "ux", "content-design"],
  "links": [
    { "rel": "source", "label": "Repository", "url": "https://github.com/tobiasalexanderwulff/tobrojekt.dev" },
    { "rel": "demo", "label": "Website", "url": "https://tobrojekt.dev" }
  ],
  "media": {
    "social_card": { "src": "/public/social-card.png", "alt": "tobrojekt.dev social card", "width": 1200, "height": 630 }
  },
  "dates": { "created": "2025-09-14", "updated": "2025-09-14", "started": "2025-09-14" },
  "featured": true,
  "priority": 1,
  "visibility": "public"
}

